{
  "$schema": "https://json-schema.org/draft/2020-12/schema",
  "$id": "urn:aibridge:contracts:v1:memory",
  "title": "MemoryRecord",
  "description": "@generated by scripts/generate-contracts.ts from src/orchestration/schemas.ts:740 (export memoryRecordSchema). DO NOT EDIT. Invariants from .refine()/.superRefine() are NOT representable in JSON Schema and are absent from this file; they remain enforced by the TypeScript engine, which is the sole authority for them (ADR 0008 §2.2 Tier 2).",
  "type": "object",
  "properties": {
    "schemaVersion": {
      "anyOf": [
        {
          "type": "number",
          "const": 1,
          "title": "MemoryRecordSchemaVersion0"
        },
        {
          "type": "number",
          "const": 2,
          "title": "MemoryRecordSchemaVersion1"
        }
      ]
    },
    "memoryId": {
      "type": "string",
      "pattern": "^[A-Za-z0-9][A-Za-z0-9._:-]{0,127}$",
      "title": "MemoryRecordMemoryId"
    },
    "projectId": {
      "type": "string",
      "pattern": "^[A-Za-z0-9][A-Za-z0-9._:-]{0,127}$",
      "title": "MemoryRecordProjectId"
    },
    "kind": {
      "type": "string",
      "enum": [
        "decision",
        "constraint",
        "finding",
        "handoff",
        "summary",
        "artifact_reference",
        "user_correction",
        "run_outcome"
      ],
      "title": "MemoryRecordKind"
    },
    "content": {
      "type": "string",
      "minLength": 1,
      "maxLength": 65536,
      "title": "MemoryRecordContent"
    },
    "contentDigest": {
      "type": "string",
      "pattern": "^sha256:[0-9a-f]{64}$",
      "title": "MemoryRecordContentDigest"
    },
    "scope": {
      "oneOf": [
        {
          "type": "object",
          "properties": {
            "kind": {
              "type": "string",
              "const": "project",
              "title": "MemoryRecordScope0Kind"
            }
          },
          "required": [
            "kind"
          ],
          "additionalProperties": false,
          "title": "MemoryRecordScope0"
        },
        {
          "type": "object",
          "properties": {
            "kind": {
              "type": "string",
              "const": "run",
              "title": "MemoryRecordScope1Kind"
            },
            "runId": {
              "type": "string",
              "pattern": "^[A-Za-z0-9][A-Za-z0-9._:-]{0,127}$",
              "title": "MemoryRecordScope1RunId"
            }
          },
          "required": [
            "kind",
            "runId"
          ],
          "additionalProperties": false,
          "title": "MemoryRecordScope1"
        },
        {
          "type": "object",
          "properties": {
            "kind": {
              "type": "string",
              "const": "task",
              "title": "MemoryRecordScope2Kind"
            },
            "runId": {
              "type": "string",
              "pattern": "^[A-Za-z0-9][A-Za-z0-9._:-]{0,127}$",
              "title": "MemoryRecordScope2RunId"
            },
            "taskId": {
              "type": "string",
              "pattern": "^[A-Za-z0-9][A-Za-z0-9._:-]{0,127}$",
              "title": "MemoryRecordScope2TaskId"
            }
          },
          "required": [
            "kind",
            "runId",
            "taskId"
          ],
          "additionalProperties": false,
          "title": "MemoryRecordScope2"
        },
        {
          "type": "object",
          "properties": {
            "kind": {
              "type": "string",
              "const": "session",
              "title": "MemoryRecordScope3Kind"
            },
            "runId": {
              "type": "string",
              "pattern": "^[A-Za-z0-9][A-Za-z0-9._:-]{0,127}$",
              "title": "MemoryRecordScope3RunId"
            },
            "taskId": {
              "type": "string",
              "pattern": "^[A-Za-z0-9][A-Za-z0-9._:-]{0,127}$",
              "title": "MemoryRecordScope3TaskId"
            },
            "sessionId": {
              "type": "string",
              "pattern": "^[A-Za-z0-9][A-Za-z0-9._:-]{0,127}$",
              "title": "MemoryRecordScope3SessionId"
            }
          },
          "required": [
            "kind",
            "runId",
            "taskId",
            "sessionId"
          ],
          "additionalProperties": false,
          "title": "MemoryRecordScope3"
        }
      ]
    },
    "author": {
      "oneOf": [
        {
          "type": "object",
          "properties": {
            "kind": {
              "type": "string",
              "const": "user",
              "title": "MemoryRecordAuthor0Kind"
            },
            "userId": {
              "type": "string",
              "pattern": "^[A-Za-z0-9][A-Za-z0-9._:-]{0,127}$",
              "title": "MemoryRecordAuthor0UserId"
            }
          },
          "required": [
            "kind",
            "userId"
          ],
          "additionalProperties": false,
          "title": "MemoryRecordAuthor0"
        },
        {
          "type": "object",
          "properties": {
            "kind": {
              "type": "string",
              "const": "node",
              "title": "MemoryRecordAuthor1Kind"
            },
            "nodeId": {
              "type": "string",
              "pattern": "^[A-Za-z0-9][A-Za-z0-9._:-]{0,127}$",
              "title": "MemoryRecordAuthor1NodeId"
            }
          },
          "required": [
            "kind",
            "nodeId"
          ],
          "additionalProperties": false,
          "title": "MemoryRecordAuthor1"
        },
        {
          "type": "object",
          "properties": {
            "kind": {
              "type": "string",
              "const": "session",
              "title": "MemoryRecordAuthor2Kind"
            },
            "sessionId": {
              "type": "string",
              "pattern": "^[A-Za-z0-9][A-Za-z0-9._:-]{0,127}$",
              "title": "MemoryRecordAuthor2SessionId"
            }
          },
          "required": [
            "kind",
            "sessionId"
          ],
          "additionalProperties": false,
          "title": "MemoryRecordAuthor2"
        },
        {
          "type": "object",
          "properties": {
            "kind": {
              "type": "string",
              "const": "system",
              "title": "MemoryRecordAuthor3Kind"
            },
            "name": {
              "type": "string",
              "minLength": 1,
              "maxLength": 256,
              "title": "MemoryRecordAuthor3Name"
            }
          },
          "required": [
            "kind",
            "name"
          ],
          "additionalProperties": false,
          "title": "MemoryRecordAuthor3"
        }
      ]
    },
    "createdAt": {
      "type": "string",
      "pattern": "^\\d{4}-\\d{2}-\\d{2}T\\d{2}:\\d{2}:\\d{2}(?:\\.\\d{1,9})?Z$",
      "title": "MemoryRecordCreatedAt"
    },
    "sourceReferences": {
      "maxItems": 128,
      "type": "array",
      "items": {
        "type": "object",
        "properties": {
          "namespace": {
            "type": "string",
            "minLength": 1,
            "maxLength": 256,
            "title": "MemoryRecordSourceReferencesNamespace"
          },
          "id": {
            "type": "string",
            "minLength": 1,
            "maxLength": 4096,
            "title": "MemoryRecordSourceReferencesId"
          }
        },
        "required": [
          "namespace",
          "id"
        ],
        "additionalProperties": false
      },
      "title": "MemoryRecordSourceReferences"
    },
    "trustState": {
      "type": "string",
      "enum": [
        "proposed",
        "accepted",
        "rejected"
      ],
      "title": "MemoryRecordTrustState"
    },
    "sensitivity": {
      "type": "string",
      "enum": [
        "public",
        "internal",
        "confidential",
        "restricted"
      ],
      "title": "MemoryRecordSensitivity"
    },
    "retention": {
      "type": "string",
      "enum": [
        "run",
        "project",
        "permanent"
      ],
      "title": "MemoryRecordRetention"
    },
    "supersedesMemoryId": {
      "type": "string",
      "pattern": "^[A-Za-z0-9][A-Za-z0-9._:-]{0,127}$",
      "title": "MemoryRecordSupersedesMemoryId"
    }
  },
  "required": [
    "schemaVersion",
    "memoryId",
    "projectId",
    "kind",
    "content",
    "contentDigest",
    "scope",
    "author",
    "createdAt",
    "sourceReferences",
    "trustState",
    "sensitivity",
    "retention"
  ],
  "additionalProperties": false
}
